Lable,Topic,Text
1,A wierd book that keeps you on the edge,"Bless the Beasts and Children is a book I would not reccomend to anyone. Even though it may keep you on the edge of your seat. You always are wanting to know what stupid things the"" bed wetters"" are going to do next. The Flashbacks are confusing and the characters are obviously mis-fits that need a life. If you like the stories about adolescence in need of attention. read this book."
1,it has nothing to do with maturity,"writing songs like this really doesn't have much to do with maturity. Face to Face was once a great band (Don't Turn Away was by far the greatest), but as a long time punk fan, Face to Face was never really very hard core. Very energetic, but not hard at all. I think I was just about as disppointed when Big Choice came out. They never should have left Fat.So this change doesn't really surprise me. Most of my friends stopped listening to F2F after Don't Turn Away. I guess I stop after the self titled (which blows Big Choice out of the water)."
1,lousy,"bought cover girl power pink lipstick, i get more color from a chapstick, can't even tell i put it on, price was low, still got jipped"
1,egh!,It wasn't what I expected. It was too glittery for my taste. But I was satisfied with the s&h. Instead I bought the Saint Germain lipstick from MAC. Now that's more of what I was going for.
1,I thought this was supposed to be face to face?,"Well I have to be honest. This one leaves me unimpressed. I was all excited, as usual, when I saw that face to face had another one coming out. Naturally I was expecting more of the sound that I love. But unfortunately, you wont find it here. I understand that musicians want to grow, want to do something different once in a while, but sometimes it just doesn't work. This is one of those times.I have to admit that I really didn't give it much of a chance. Maybe it is better than I think after all. But the only way that is possible, I think, is if you listen to it and try to forget that it is face to face you are listening to.Otherwise, if you are looking for anything like, say, ""Nothing"", hearing this one makes you think you will never hear anything like it again from this band."
1,Everyone....the Face to Face has gone bad.,"I guess this is what age does to good punk bands. It's a shame, I tell you. They used to be good. They used to be real good."
1,1-Star Emo,"I doubt that the individual who wrote the review titled ""Five-Star Emo"" has even a vauge conception of what Emo is. To those who think this is a great album, I guess ignorance IS bliss."
1,It's bad!!!!!!,"To think I used to like this band. The only good song is Prodigal. Even then its just a mediocre song. What happened? What about don't turn away. I'm sorry but this is just bad. It's week, slow, boring, and all around bad"
1,Talk about a 180,"This album was nothing I hoped it would be. They sound like the 90's version of Bon Jovi on this album. Don't get me wrong, I'm a huge Face to Face fan and loved every album before this one, but this is unbelieveable. I was really in shock when I thought how I wasted my money buying a Face to Face record. I never thought it was possible, but it happens. I still love there other albums."
1,"Impossible to turn knobs, awful sound quality","I bought this and after using it a few times, I wish I would not have bought it.Knobs are impossible to turn when wet (small, round and smooth) just what you DON'T want in a shower radio.When you turn it on, it goes from no sound to BLASTING with the smallest adjustment. Nearly impossible to get a non-deafening level.Does stay on the tuned station, drifts up and down.Look for another model."
1,The Worst Album I've Ever Heard,"Face to Face has gone emo, and while I do love emo, they are terrible at it. This album should have never been made."
1,A Face to Face fan,"Ignorance is Bliss is the kind of punk you buy at the Gap. Totally off track! I understand that they are trying to grow, but their oldies are goodies!"
1,I Don't Think So !!!!!!!!,"WELL, I must say that this book is on my list of books I say were painful to read, heck PAINFUL to finish. The writing did seem adolescent and didn't have solid findings as it went on . There were too many discrepancis and so it seemed, not logical research had been used.I am an avid reader and I am firm on not going to the back of the book nor do I stop it the middle, because the book, well,... sucks. This was the second book that I had to cheat on, due to it's unrealistic and very predictable plot. It was the first book by P.M. that I have read, I am a bit disappointed. Would I rate this higher the 1, I don't think so!"
1,Sleeping Beauty,"Margolin is a long time favorite writer of mine, however, in ""Sleeping Beauty"" with its never ending cast of characters, and convoluted plot, I feel I could crawl into bed with the sleeping beauty and join her in her comotose condition and not miss anything. My brain can only take so much and in this rendition Philip has burned me out.We have the rape of Tanya, the murder of Terri, the murders of Ashley's police guardians, and then, finally when Casey Van Meter emerges from here coma the killer makes an attempt on her life. He is finally caught, convicted and sentenced to death...hooray!! Wow, in retrospect I wonder if it would have ended better if Casey had joined all the murder victims.E.J. Walden, author of ""Operation Snow Owl"""
1,Really....,"I know that this is a story, and with that comes some parts where you need to allow your brain to let go of certain things that you know as reality. This book became almost monotonous to read...This was my first read from this author - and will certainly be my last. The plot was as if a ten year old wrote it, and the characters were all horrible! I did not enjoy this read at all."
1,dont bother,works fine to soften dry under eye skin but doesnt help either puffiness or dark circles. any lotion could do the same thing. not worth the money!
1,Ho Hum!!,"I've read several good books by Phillip Margolin and either I've grown away from his style, or this book is really boring! With an unbelievable plot and cardboard characters, there's very little I can recommend."
1,not good,"I have to echo the previous comments regarding the wooden dialogue and two dimensional characters. This book had such a good premise, but Mr. Margolin hasn't taken much effort to flesh out his characters. They are typical ""stock"" mystery type characters: the gutsy survivor/heroine who falls in love with her tender young savior. The sassy, nurturing and buxom black female district attorney. The sinister and wily bad guys. And some of the legal details within the story are not plausible. I just wish the writer had put more effort into developing characters, it's tiring reading about such stereotypical people."
1,Disappointed,This looks like the same color on for a little bit-- then when it's almost gone it goes to a funny orange. I'm thinking its a knock- off or something. I still had a small amt. left of an original and it sure didn't do what this lipstick did. My husband asked-- what do you have on your lips-- he rarely notices a thing...
1,Not a good source for treatment options...,"I was recently diagnosed with Sjogrens and have now read most of the books out there. This one, while good with the emotional issues of dealing with a chronic illness, is severely lacking if you are looking for treatment options. Yes, it provides the standard treatments for dry eyes and dry mouth (as do pretty much all of the sources out there) but if you have any additional manifestations whatsoever (especially extraglandular issues) you will find no help here. Yes, it does tell you that Sjogrens can affect your lungs, for example, but it goes no further than that (no treatments to pursue, no suggestions whatsoever). There are much better books for your money (for the most comprehensive quick-read try Positive Options for Sjogrens Syndrome by Sue Dyson)."
1,Overview of Sjogren's Syndrome,If you knew nothing about Sjogren's this would be the book for you. I had read about this syndrome online so it really didn't tell me anything I didn't already know.
1,Junk!,"I bought the Swiss-Tech Utili-Key 6-in-1 keyring tool at Wal-mart. I dropped it once, and it broke in half!I don't mean it broke at the pivot point, but the metal itself broke! The model number of it is UKCSB-2. It mayhave been made as lower quality for Wal-mart, because I notice that a similar product sold at Amazon is model UKCSB-1.The price wasn't much different than the similar product at Fred Meyer, though.I will avoid all Swiss-Tech products in the future."
1,Don't waste your money !!,Terrible writing. Flat characters . Boring plot. Like reading a high schoolers' attempt at a novel. Couldn't finish it. Life is too precious and there are too many good books out there waiting for me to read them !!
1,This is not literature,"While the plot intrigued me somewhat (enough to finish it), I couldn't stop screaming at the pages about how far-fetched it was. The author didn't seem to have his own voice, making a stereotype out of every character, whether it was a jolly black female, goodie two shoes attorney, innocent maiden or an ice-queen mother. I am reluctant to believe that this writer had written better books before, if he did, he must have had a really bad writer's block to plagiarize someone else's work this time!"
1,bummer,"broke the first time i used it , screwdriver part didnt handle bit of torg , there is an warranty so im sending it back and we will see what happens ??"
1,"Should make the list ""Worst books ever published.""","Simply awful writing, immature, as if written by a teenager instead of a previously published author. The chapters were back and forth from one time period to another, difficult to follow.In the book, Miles tells his readers at a book signing that authors should ""Show, not tell."" But Phillip Margolin did not follow that advice. He told, told, told, boring statements such as... He looked stunned. She felt awful. She was startled. He looked angry. She looked happy. In one instance, ""His eyes dropped to the table."" Ouch, that must have hurt.Don't waste your time on this book. Why it ever got published is beyond understanding."
1,Good idea poor quality,Mine broke within 2 weeks of having on my keychain. The metal loop that attaches to the keychain broke clean off. Look for a better quality tool elsewhere.
1,Weak magnets = very fragile construction,"We purchased this set and another smaller set for my three year old son for Christmas. I was skeptical that these could be better than the Legos that I myself grew up with, and for good reason. The magnets on Magna Tiles are, in my estimation, very weak. They just barely hold any of your building projects together and, like a house of cards, only the smallest bump will cause the whole thing to collapse. You'll spend far more time picking up the pieces than you will enjoying the final product. Forget about using the car for anything substantial; you won't be able to ""drive"" it once you build on it.More permanent building-block style toys are far better than these Magna Tiles. I would return them if I could."
1,What the hell was Ark21 thinking?,"I purchased this album because I wanted to support a local artist, since he lives right in my city. Primarily, I picked it up because it was on the Ark 21 Records label, who has consistently put out really interesting hip hop releases, that are at least what I'd consider meat and potatoes, fundamental hip hop, with a little more towards the experimental side every once in a while. This album was super disappointing. It's so cliche and unoriginal, so different from what this record company is used to. If you're expecting something up to the normal Ark 21 standards, don't purchase this album. Even for the gangster style it barely pulls off, the rhymes are average, less than intimidating or entertaining, and the beats are too old school with that synthesizer cheese. If you want something from the traditional gangster style similar to these small independent gangster labels, then definitely listen to the sound clips first, cause I still wouldn't recommend it."
1,WORTHLESS,"This stuff is a waste of money. It did nothing for my somewhat damaged hair,...except make it really difficult to comb and dry looking and stiff,..and limp. Everything a bad shampoo would do. I have never liked Tigi products so I don't know why I bought this. Probably to assure me that nothing works as well as Klorane shampoos & conditioners,.which Im sticking to from now on. No sulfates either."
1,Not what I'd like for it to have been,"I thought this CD was going to feature Don singing with these fellas. There was no singing at all. Just instrumental. On some of the songs you can't even tell Don is in there anywhere. The instrumentals I guess are ok, but I'd like to have heard more of Don. As a matter of fact, when I first got it, I didn't think he was even involved. That is until today when I got my boxed set - 1960-1966, when I saw that Los Indios Tabajaras is actually on these CDs. Maybe I'll listen to it again and do a new review. Until then, I don't like it."
1,janet's losing it,following mike;s footsteps this shows anything can sell now this is one of the worst songs this year next.
1,Awful.,"Singing? Um no, it's a lot of repetitive talking. My kids BEGGED me to turn it off so I dropped it of at the thrift store. Hopefully somebody else can find good use of it. I've found a ton of better state/capital songs for FREE on youtube."
1,"Not engaging, not useful","I had high hopes for this CD, as I'd like a fun way to teach my kids the states. However, the ""songs"" are mostly kids speaking the words (not singing) with a musical background. The details about the states are not consistent -- for example, for one state you learn when it became a state, for another, what its state flower is (how is that relevant to what the state is like?) and yet another, the major crops or the weather. It's useless as music, and useless as learning. The Animaniacs ""States"" song is much more engaging; I think I'll teach that one to my kids."
1,Not All That Good,The album version is the best version on this single. This song is a peaceful song. The dance remixes aren't doing this song any justice. Just stick to the original.
1,Just Not Interesting...,"I agree with the reviewer's title ""Merely An Okay Read,"" in that this story was quite dull and if not for Nicholas & Eleanor it would really have tanked. This Leander had zilch for personality."
1,Wrong Filter,"It was so convenient that Amazon provided pull-down menus to help you find the perfect filter for your vehicle. Too bad it's the wrong filter.This filter does not fit a 2004 Ford Escape 3.0 XLT no matter what they say. I needed to purchase something for around $4.00 at Christmastime to get free shipping. Although I didn't need it yet, I ordered the filter. Now it's February, past the return date, and the filter doesn't fit. Just be careful when using Amazon's part finder."
1,Not worth buying,"Couldn't give it 0 stars or would have. Disappointing read from beginning. Writing style was elementary, characters were two dimensional, dialog was stilted and unnatural. Figured out real murderer early on. Forced myself to read the whole book because I had paid for it. Test of endurance. Major blooper on page 313 (hardback version) - even editors and proofers had quit reading by then. Don't waste your time."
1,"Good product, just too pricey.","Since I could not post that the product is too pricey at the recently raised price I'm going to lie and say it is nicely priced so I will not get an e-mail telling me my review could not be posted because I put truth, and was well within all guidelines with what my review said before...I gues you have to say something good to get a review posted? SAD"
1,Usefulness depends upon area studying,"This book was not nearly as helpful as I expected it to be. The photographs and drawings seemed like they would be really helpful. However, I found it very confusing to try to figure out which picture corresponded to what my specimen actually looked like. It was most helpful for muscles, and least helpful for nerves and vessels. It is also very time consuming to look up the particular item and then flip through many pages looking for a picture that shows your item of interest clearly."
1,Not Recommended,"Yes, it was under $15. But, it is overpriced at that amount. The mirror fogs. The radio won't stay on station. Buy something else."
1,Skip this shower radio,"I got this shower radio for Christmas and was excited. Also, the radio is only splash proof and can only withstand a small amount of steam. Because of this I didn't feel comfortable hanging it directly under the shower head by the rope, so I used the suction cups and placed it at the far end of the shower. But, I was constantly afraid that the suction cups would fail and the radio would fall. I used it exactly TWICE (total time was about 30 minutes) when the volume (on/off) button broke. Thankfully I still had the packaging but I had to pull it out of the trash can to return this thing. Think I'm going to try to find a different shower radio."
1,Huh?,"I was expecting a great punk album, but instead it sounded like the Goo Goo Dolls. F2F has sold out to reach a wider audience (and sell more records).."
1,Not sure.,"I don't know if I'm qualified to judge this product. All I know is it did not work the way for me I thought it would. I had been told that as you age, you stop producing HCl for digestion. I thought if I took this product it would help with stomach health. It didn't. I actually had more stomach distress. I'm not sure if it was caused by the product. It just didn't work for me."
1,4 Seasons 38646 Orifice Tube,"This item does not fit the 2001 Chevy Prizm, but the description says it does. I hope that Amazon and 4 Seasons will change its description to better serve the buying public."
1,nice try,I have been a fan of Face To Face for about eight years. I've liked pretty much every album they have released and I won't say I dislike this one even though it is by far the worst they have. Most likely they wanted to grow as a band and stop playing tired old punk rock but what they should realize is that's what there good at. Some songs on this album are good but some ar so cheesy it's hard to listen to they sound like really bad Bush songs. I give the guys credit for the effort but fellas don't try this again stick with what your good at.
1,"Laborious, at best","A tiring read with content nuggets few and far between, this book is tough to get through. Endless dialogue between the players in yet another ineffective novel format, you'll be skipping pages looking for ideas you can actually put to use. With excellent books already on the market covering the concept of ACCOUNTABILITY this book by Lebow/Spitzer is superfluous. I recommend John G. Miller's writings: ""QBQ! The Question Behind the Question"" and his first book ""Personal Accountability."" These are content rich, loaded with terrific stories, and practical. Plus, having just seen Miller keynote a meeting for us, he truly understands personal accountabilty and its application at work and at home. Excellent speaker!"
1,Bonus Tracks Can't Save This Album,The bonus tracks can't help what turned out to be the worst album of 1999. It's a shame that this has happened to such a great band.
1,Didn't work for me,"The mechanism that pulls up the stopper in the tank doesn't have enough range to open the flap completely without holding the handle down. IE - The handle moves only slightly when you push down on it.I tried working with it for over an hour, but the design was too limited to replace my original equipment. Had to return it. I found another brand (fluidmaster 686) that worked for me. The handle was plastic with a metal lever, and it worked - had the range to actually lift the flapper off the drain and flush completely without holding down the handle."
2,Highly recommend a replacement plan,"This is an excellent toy, however, the touch-screen durability leaves a lot to be desired. There have been 4 Leapsters in my house in the past 18 months.I purchased the first for my 4-year-old. That one crapped out less than a month after purchase, so I took it back to the store. The second was covered by a replacement plan. After the second one died, I called the replacement-plan administators who instructed me to send the game to them. Three weeks later, I had a check for the replacement.I finally replaced that one and to top it off, I also had to purchase another for my 2-year-old. In total, my house has seen 4 leapsters.I strongly encourage one to purchase the replacement plan. $15 extra in the beginning saved me $140 on game consoles and over $200 worth of games that would have been rendered useless. Imagine those numbers now times 2.This is no exaggeration."
2,LOVE IT LOVE IT LOVE IT!,"Short and simply, this is a must buy toy. Very educational and FUN. Hours will be spend playing and learning. This product is worth every penny.The product itself is very well built. Batteries last a long time. The cartridges are filled with activities to do. It is very portable.I thought the leap pad was great, but this is much more wonderful."
2,My Daughter Loves It,Great for travel or to play around the house. The games are educational and my daughter does not get bored of it. She had it when she was three and she is four now.
2,leapster,Love it. All three of my kids have one. I can't believe how much they have learned. Video games like these I don't mind the kids playing.
2,No Stopping My 4 year old!,"We gave this to our little boy on his 4th birthday. He loves it, is learning tons, and it keeps him quiet in the car. He is also very rough with his toys and it is holding up perfectly. Great purchase."
2,Great learning game!,Game gives child the feeling of having his own very functional video game and they learn fast while using it. To be honest I enjoy playing with it also.
2,Leapster FAILS!,"Why the Leapster was fun for my kids when we first got it, we have had to return two Leapster because the screen will not calibrate. This has only been in a two month period. If I have to return to get a new one every month it is not worth it. I am curious to hear if the Pixster is having the same problems."
2,"brain-food, this is good even for the solitary","An outlay of many different types of well-built ritual and ceremony; I don't get the empty feeling of ""but something's missing here"" that i do when reading buckland or cunningham or starhawk; some of these (especially ""Das Tierdrama"")could be put to use no matter what your religion (even if you're an atheist), and of course the Satanic Baptisms can made to fit any religion that utilizes magik and/or the four elements. There is something powerful and moving to these rituals (even just READING them), and they seem to have more than just one or two layers to them. I believe it's the best book of rituals I've ever seen."
2,A Truly Delightful Read,"What a delight to read. There was so much emotion and strength in this book that it has been a treasured (and much read) addition to my library. It is one book that has appeal to both non-Trekers and Trekers alike. The message is so universal. The inspiration held within these pages is incredible. Much like the messages within Consillium and other works of Mr. Nimoy's, it is a guide to overcoming many of the the innumerable tests in life. A must read! Very uplifting!"
2,Leonard Nimoy is a TRUE POET not just an actor.,"His poems are truly worth reading and rereading. He is truly a classic poet in my mind along Keats, Shelley. Time will tell but Leonard Nimoy is a truly gifted person."
2,Excellent book from the 1950's,"A unique enjoyable reference book that covers fads and unproven or controversial scientific notions. Surprisingly, there are some topics mentioned in the book that seemed farfetched science or theory to this mid 20th century author that may be on the way to provable fact from the efforts of contemporary 21st century scholars and scientists."
2,Pictorial Rich,"Very good pictorial of Kuwait: representing its culture,geography, and modern architecture. Would have liked to seen morepost-war pictures of its infastructure following the war, but good visual book nonetheless."
2,no speakerphone option,This phone set works great - my only complaint is that there is no speakerphone option on the handsets.
2,Hello!,I have been a fan of Motorola for years. I liked the look of this and the price was right on for what you get. My only complaint is the address book only holds 10 phone numbers. The hand set holds another 10 so you've got 20 total if you can remember which phone has which numbers. Other than that it performs well with the other features. The ring is somewhat annoying but it does get your attention. Luckily I have a cell phone(Motorola) with all the numbers I need.
2,Your own voice is loud in your ear,"These phones work well in all aspects except that when you speak into the handset, your own voice seems to be amplified into the speaker at your ear. I find myself having to change the position of the phone away from my ear in order to not blow my ears out!Also, no headphones jack."
2,Great to entertain,"I bought this for my daughter, who at the time was 4-1/2. She liked it but required help with learning how to move. As she got older & used to it she enjoyed it quite a bit, she even still pulls it out on occasion. The only down side was with the system itself as it requires a VERY WELL LIT room to function properly."
