Lable,Topic,Text
2,The best video for beginners!,"This video has simple instructions and poses for any beginner. I found the Yoga video every helpful for people unfamilar with the Yoga practice. It discusses how Yoga works the body and the mind without being flowerly. The poses are so basic and comfortable, that any beginner can use this video to gain strength without feeling like a pretzel."
2,Gadsby,"This book is totally worth reading if you're interested analysing in how he managed to write a novel without using the letter ""e"", but by god don't read it hoping for a good story - Wright was a terrible writer."
2,"""...And the time has finally come for me to pack my bags and walk away...""","The music of the Marshall Tucker Band brings neverending enjoyment to my ears. It's like the Metallica of Southern Rock: I just can't stop listening. Their first self-titled album is solid from beginning to end. ""Take the Highway"" and ""Can't You See,"" both being my personal favorites on the album, should be considered timeless classics in the Southern Rock genre. The other songs, including the 12-minute Everyday (I Have the Blues) recorded live, are extraordinarily well-written and well-played. To be honest, however, this is the first time I have ever stumbled across an album by the Marshall Tucker Band. And I don't think I'll stop right here. This is great music; it's certainly better than the mainstream music that we have today. Up next: the second CD called A New Life!Grade: 9.5/10"
2,Phenomenal,"The debut album from The Marshall Tucker Band is one of the greatest. This album brings out the sound that MTB does so well, from country, to rock, to blues, all rolled together into a southern sound. Doug Gray's vocals on ""Take the Highway"" are fantastic, Toy Caldwell's ""Can't You See"" remains a favorite, ""Hillbilly Band"" adds a bluegrass feel, ""Ramblin"" is full of energy, and the live ""Everyday (I Have the Blues)"", displaying how massively skilled Toy Caldwell was, is one of the greatest guitar songs I've ever heard. All in all, I highly recommend this album to every MTB fan along with fans of Southern Rock and Country rock."
2,cell phones,it is nice to be added to another line - I don't use that many minutes and i feel better being on another plan.
2,good coverage but Cingular style antics,"Cingular offers the best coverage in San Diego and probably southern California. We only used 350 of the 550 because most of our friends also have cingular (free m2m). After reviewing our bill we had over 3000 minutes combined or about 2cents a minute. The only cons i see are that 1) Cingular will be raising the sms from 10 to 15 cent. Total ripoff! 50% increase wow! 2) the first month you need to pay in advance. I at first did not understand, but I took a long look at the bill and talked to CS to clear everything up (when our service is over I will only be paying taxes and any additional chargess)."
2,A Masterpiece!,"Yoga Anytime Anyplace is beautifully done! It is unusual to find an exercise video that is as attentive to artistic detail as this one. Not only is it a complete routine that is revitalizing and refreshing to do but the use of rich colors and wonderful music interwoven throughout makes it fun to watch again and again. Ameeta Nanji is easy to follow; as her clear voice helps to still and focus the mind, she encourages the body to stretch a little bit further. As a Shiatsu practitioner I find this to be a good complement to my daily exercise program."
2,You Need to Check Out APRIL SIXTH!,I saw this band live in California and trust me -they are the best band I've ever seen perform! I bought this EP and I listen to it constantly! It's one you'll never tire of. Stop what you are doing and buy their EP.
2,He truly is the King of Pop!!,"This video collection re-proves his title. It contains some rather riveting videos, and some that are just plain cool. From the space adventure of ""Scream"" to the dramatic ""Earth Song"", the cassete has it all. A must have for fans!"
2,Great DVD,R.I.P. King of Pop and performer of the century! This DVD is great! I liked it so much I have given a couple away as gifts.
2,great carseat,"This carseat is so fantastic. We bought 2 of them, one for our toddler and one for our 5 month old. Both ages are great for this seat, it is comfortable and my husband says it is really simple to install. As well it was simple to adjust the harness for each of them. It is nicely padded, our daughter says it is very comfortable. I read some reviews that the reclining feature was nice for when their kids went to sleep but if you install it correctly the reclining feature is only to make it fit your car properly and for when it is rear facing, you have it in the recline position...which is nice for when they are asleep their heads are not flopped forward.we bought the seats directly from BabyAge because combined shipping was $7.highly recommend this seat!"
2,Are the videos full-length?,"I have never been able to find music videos when I want them. Are these the original, full-length versions or should I look elsewhere?"
2,THE King of Pop,"I think that Michael Jackson is the BEST! I haven't loved him that long.But I know all of songs from ABC to One More Chance.I been loveing him since 2001.Well, to get to the point Michael Jackson is the BEST of ALL TIME.It don't mata what people say Michael is the best.People can call him this or that but he is the KING......Thriller #1,Off The Wall #1,BAD#1,Dangerous#1,HIStory 2 #1's,BOTDF#1,Invincible #1,and I know Numbers Ones that is coming out is #1.So u can't say anything else cause I'm sticking 2 it.And nobody can say anything.........!!!!!!!!!!!!"
2,It is a great collection of some of Michael Jackson video's,I enjoyed the fact that I was able to see the MTV performance. The Earth song video is the best video I have ever seen.
2,Amazing,"I love this DVD. However, I wish they would have kept the ""brace youself"" at the beginning of the film instead of putting it at the end, lol :PAnd I wish they would have included the 2 Bad short film in there as well. Overall, I loved it. I always love watching MJ vids. I would definitely recommend it to any MJ fan."
2,Michael Jackson,This DVD was exaactly what I was looking for. It showed all the videos of the songs I am familiar with and some others I was not. The reveiews of some of the other videos lend me to think this is the one I wanted and they were right. Very good DVD for and MJ fan.
2,Michael Jackson History on Film,"This video covers a very good sample of his dancing and it is a great experience. Watch it, love it, keep it!"
2,Great for MJ fans,My son is a true MJ fan so he loves this. Its a collection of music videos of some of the best tunes that MJ ever made. Smooth Criminal is my all time favourite video. :)
2,"Michael Jackson - History on Film, Vol. 2","My son had purchased this video when it first released. He let me borrow it but, there is nothing like having your own copy. So I purchased a copy for myself. Watching it brings back memories of when the various videos had aired on television."
2,Michael Jackson History on Film Vol. 2,A MUST have for any Michael Jackson fan for sure!! Loaded with greatness. If you haven't seen this one you need to.
2,"""History on Film, vol.2"" is a good collection...","There are many good videos on this dvd, including ""Scream"" w/Janet Jackson, ""They Don't Really Care About Us"", the classics ""Thriller"" and ""Beat It"", and the underrated ""Blood on the Dance Floor""."
2,The Best Collection Of Music Videos Ever Compulated!,"Michael Has done it onece more, video after video he keeps getting better and better."
2,HIStory Vol 2,"Michael Jackson - History on Film, Vol. 2This is a beautiful tribute to a part of Michael Jackson's career. He hand picked each piece and made it for his fans to cherish. He took his God given gifts and fine tuned them into the magnificent King of Pop that will live forever as long as we continue to play his music and watch his videos. He captured our hearts because his own heart was bigger than any person I've ever had the pleasure of knowing. His music and dancing will live on forever as long as we listen to his songs and watch his short films. I don't want the world to forget this beautiful creature who took the basics of entertaining and catapulted them into the moves we've been attempting to copy for years. He was a wonderful Father, a Fabulous Entertainer and One of a kind; and he was my friend. I miss you Michael."
2,Fantastic complilations of Michael Jackson's short films,"I'm going to be honest. I got this video for one reason and one reason only. Although I can view it online, I HAD to have the EPIC Scream video so I could view it on my television. It is amazing quality, too. There are other favorites of mine on this video as well which is the best video or short film as Michael preferred to call them and that's Thriller. You will also get the video that skyrocketed Michael's career to another galaxy and that's the Billie Jean performance at the Motown 25: Yesterday, Today and Forever anniversary. The performance that the late legendary Fred Astaire who happened to be one of Michael's idols next to James Brown. It was also the performance that was enjoyed immensely by the late Marvin Gaye. This is a must have for every Michael Jackson film."
2,Best DVD that i have bought,"Since I am a Jackson fan for more than half of my life now (I am 21) and not only his music but also the man himself are very special to me, you could say that I am not exactly the ideal person to critic this dvd. But for those, who, just like me, love Michaels music and his performances with all their heart, this is the one dvd to have. And for those who don't like Michael's work but who are interested in seeing some of the best chartographed dance performances, this dvd is still worth its money. Finally, I hope that there will be a 3rd ""HisTory"" Video/DVD for there is surely a lot of material left, that isn't inclouded in ""History - Video Greatest Hits"" or ""HisTory on Video Vol. 2""."
2,WILL SERVE PURPOSE,THIS ITEM APPEARS THAT IT WILL SERVE IT'S PURPOSE WELL. WE HAVE NOT USED THE UNIT IN FOUL WEATHER AS OF YET BUT IT LOOKS GOOD
2,Multi-family Genealogical Gem,"I purchased this strictly for the discussion of the Bridgewater Leonard family of which I am a descendant. Like many of the family genealogies of this era (1928), there are no sources quoted, as required by serious, modern genealogists. It does, however, make for very interesting reading. The author goes on to discuss her other family lines including the Taunton Leonard family, the Aldens, etc. At the end she lists each family's genealogy as well as identifying royal lines that go way back into history."
2,one of DISNEYS best,"i first saw this when it came out, & thought it brilliant that is why i have bought it.of all disneys works next to this is Snow White, again i saw this when it first came out,& it is a pity they have not come(to me anyway) anywhere near making anything as good. the Living Desert I would say to anyone if u have not seen it, then you are missing a lot,not only for the music, but the antics as well."
2,Fantastic Book!,Not much more to add than has already been said. This book is great. If you are traveling to southern Utah - get it!
2,The best there is,"I already own the 1th Edition and used it extensively to find rare to be seen places in the Southwest. I am German and visit the Southwest once or twice a year and found this book to be invaluable. Easy to follow directions, great images, good advice. You don't need any other guide to see all the best places (which no one else finds)."
2,Tanner's back for another trek across Europe. A delight.,". Tanner is back in the third of eight books in the series. This one is much better than the first two. Again Tanner leaves NYC to trek across Europe, sneak across boarders. This time the trip takes him from home to Yugoslavia north to Russia. Keeping in mind this adventure as wells as the two others takes place before the brake up of the Soviet Union and the problems and war with the breakup of Yugoslavia. Block's historical accounts are excellent and add to the excitement of the book. It's well paced and I look forward to the others in the series. At this point in time they are on backorder at amazon.com."
2,My all-time favorite book!,"I just purchased this for a friend. I would have loaned her my copy, but I've loaned it out to so many people that I can't remember where it is anymore. Basically, a bear comes out of hibernation and finds a briefcase containing a manuscript and a necktie. He puts on the tie and takes the manuscript into town. Nobody seems to notice that he is a bear. Women think he is wonderful. In the meanwhile, the poor author of the manuscript is falling apart. This book is perfect for a time when you don't really want to think. Just relax and enjoy Hal Jam's journey."
2,what a pleasant surprise!,I picked up this book expecting a light flight-consuming read and was blown away by the simple but beautiful prose. the tale is too fanciful to sustain for 300 pages but that is a minor fault when compared to the author's imagination and masterful writing. I urge any curious reader or aspiring writer to read (and re-read and re-read) the second to last chapter; it features some of the best writing I've come across in years!
2,Funny and insightful,Ok this is one of the most satirical and funny books I have read in some time. The bear is great and I loved the illumination of the superficial world of publishing and book selling. You must read this book!
2,Fantastic Southwest,Book is an excellent source of information for our planned upcoming trip to Utah. Well worth the cost and I am ordering more books of the southwest area soon.
2,A Bargain,"For the price of one book you get the value of two booksand a movie. First, there is a very funny story. So, you getan entertaining novel. Second, it has so many examples ofthe gulf between ""what is said"" and ""what is heard"" that youalso get a text to use in marriage counseling or employeerelations. (It would brighten up both of those scenes.) Third,Kotzwinkle's language paints such vivid pictures that youthink you have already seen the movie."
2,What A Kick!! Makes you take a break!,"The book is a kick in the behind! You see people/characters in real life that would do exactly what the characters in the book are doing! This will not be appreciated by people caught up in the race, that don't know it! Better for the rest of us! Sit back, take a little break, and let your tummy do the excercising! (The laugh muscle's can never get built up enough!!By the By: bought the book, after borrowing it from the library"
2,"Great read, funny!","I was so gald to find this book again. I read it several years ago when my son let me borrow his copy. Then I lost it. I ordered two copies, one for me one for him. The books shipped to me in time for me to mail one to him for Christmas ( we live in different states). Both books are in Very good condition."
2,Wonderful satire and humor,"I read this book because there was a reference that it is thesame sub genre and similar kind of satire and humor as ""Rats on Strings""by Guy James. That reference was correct. And I enjoyed ""The Bear"" a lot -actually I read it already twice. Would recommend to anybody. Five stars."
2,Laugh out loud funny!,An incredible running gag sustained for 300 pages. Bizarre characters and keen insight into the human condition. I loved it
2,Fable for the Ages,"The characters are clich, the plot is easy to follow but isn't that the point with a fable. Kotzwinkle takes something we know, or think we know, and twist it to show a window into our nature. This is an excellent book, that's insightful and very funny."
2,Homorous!!!!!!!!!,"This is a book I can read over again(at least once a year).It has much humor with a Bear striving to become human,whileat the same time the human is getting out into the outdoors with nature.So this novel has an interesting twist."
2,A Charming Story,"A charming book and genuinely funny to boot.It's impossible not to like Hal Jam, a true innocent abroad, as he makes his way through the shark infested world of publishing with absolutely no idea of what's going on.This book is also the source of a long standing arguement between my brother and me, he read this book and insisted Hal was a real bear. I said otherwise. Reading the other reviews I'm not so sure now."
2,Fabulous book for photographers,"This was a very helpful book. It gave suggestions on where and when to go for spectacular photographs. The only reason I gave it 4 stars instead of 5 is that there wasn't enough information. I went to Zion National Park and there were only a few pages on photographing the park. After 2 days in the park, I found many other spectacular things and places to photograph which would have been nice to be included in the book."
2,"Southwest ....Zion, Bryce","Great informative book for planning travel to Zion, Bryce Canyon and surrounding areas. It is a definite ""must have"" for every photographer traveling in the area."
2,Outstanding Resource,"Our family had planned for 7 days in southern Utah and we were having difficulty deciding on the many options available. Many of the guide books and hiking guides did not provide the information we were looking for - out of the way photography locations. This book is a fantastic resource for those individuals looking for sites with incredible viewing possibilities, many of which are not well published. The author also provides tables outlining road conditions so one can plan a visit based on their vehicle capability. The only thing missing from the book is a formula for controlling the weather to improve your photographs. This book became our primary planning and resource tool and provided photography opportunities we would have otherwise missed using our other planning guides. Thank You!"
2,"LAMENT FOR A MAKER is complex, challenging, absolutely fascinating!","Michael Innes has written many mysteries, all of them worth reading. LAMENT FOR A MAKER is an absolute classic! This is a book I will read over and over!"
2,Enjoyable Read,I really enjoyed the characters in this book and the storyline was great. I would recommend this to anyone who has enjoyed the Archane books in the past this one doesn't let you down.
2,Best villian ever,is the 'Killer Diva'. I just loved her. I don't know how she came up with her but I thought she was fabulous. I liked the main characters also - I thought they were pitched just right. Enough character / 'tough life' stories to make them interesting but not so over the top they were unbelievable. Of course you have to buy into the whole Arcane Society thing but if you can it all works. I would like to see at least one main character who is not an off the chart talent though. One thing I appreciated about Running Hot was the minimal fill-in stuff about the Arcane Society. I've read all the other ones and was glad to see I didn't have to wade through a lot of repetitive explanations.
2,Visual and Musical Masterpiece,"I have watched other musical DVDs in the past but, this DVD was so captivating. The visual sets and the musical compositions are outstanding. Carmen has such great presence and great vocal artistry. The supporting musicians are fantastic and work very well together. The only thing that could have been better was to have attended the live concert in 02/05. Luckily, with this DVD, we can relive those moments. There should be an award for best musical DVD, I am sure that this one would win ""Hands-Down""."
2,Fantastic Package.,"This a great concert DVD. Carmen Lundy is a wonderful singer and composer. She is fantastic is this live concert performance in a small theatre in Los Angeles. She is supported by a group of outstanding musicians in performances of her own compositions. The musicians include Bobby Watson, Steve Turre, Victor Lewis, Smitty Smith, Nathan East, Billy Childs, Robert Glasper, Phil Upchurch and Mark Shim. The photography and sound are first rate. At times, there are two drummers and three bassists on stage, but the music supports the numbers of musicians, and things stay organized. The band looks and sounds like they are having a great time. Ms. Lundy displays her wonderful vocal range and dynamite personality. There are many fine female jazz singers at this time, but Carmen Lundy stands apart because she also such a wonderful songwriter. She is deserving of a larger audience and much wider recognition."
2,old friend...,"this is an eminent jazz singer and composer in outstanding form! carmen is absolutely wonderful and the music she dresses herself in is supreme. a love supreme, this one is. a love supreme..."
2,Reuters Guide to World Bond Market,"This readable work helps clarify the vastness and the growth of the world bond market. The focus is mostly on the G-7 countries. Topics include the global economy, technical outlook, and country-by-country politics, ratings, and public debt. The information is dated which is understandable in such a fast moving market. It is a great overview. I would buy a new and expanded edition if it were offered."
2,Hasn't broken yet,I've had this wine opener for close to three months now and it's working very well. Not one damaged cork. But everyone else's reviews about this thing breaking down has me nervous. I only hope mine stays healthy because it is a fine product so far!
2,IT DOES THE JOB,"I wasn't thrilled with this binder, because the metal rings catch a lot and they don't entirely touch, but it holds my papers together. I would recommend it for someone who doesn't want to pay $10 for a binder and doesn't intend on opening it and closing it regularly."
2,great buy,"cannot get same great deal even buying the store name products. dependable, easy to use and ships quickly. would purchase this product again."
2,Good Binder.,"I received this binder today and was disappointed. The binder is of good quality but it does not have the four pockets advertised. It only has two. The rest of the description seems accurate. Having just received them, I can't speak for the lasting durability but I was not disappointed in the overall quality. If you want the extra pockets, check out another binder."
2,House Oversight,"This binder is EXACTLY what I needed to keep my pages organized. As an important Congressional leader, I have many pages in my office, and hope to have a steady supply of new ones coming in the future. As soon as I saw that one of the features of this binder is back-mounted rings that allow pages to lie flat, I knew I had found the perfect tool for organizing pages. I had never really even thought of using binders to organize them, but this really keeps them under control. Thanks for the great idea, Mitt!"
2,"Yes, it is a 2.5"" SATA enclosure","It does a decent job of providing a USB interface to your 2.5"" SATA drive. Nothing great, nothing terrible."
2,works well,"Hassle-free installation. I have a couple of ATA drive enclosures too, but this one is better quality. I read of SATA enclosures that proved useless because underpowered. I didn't want that to happen with this one, which is why I chose the Macally. One reviewer noted that sometimes the second USB plug is not needed; however, my Toshiba 200 gig drive would not spin without extra power. Luckily I have a 5V 300mA AC adaptor for an external CD burner and it works great with the Macally, limiting the USB requirement to a single plug. For info, the adaptor is GME model GFP121U-0520.No mention in enclosure manual about supplying separate power. Dock one star."
2,Works Great,"This 2.5"" enclosure really works well... The extra USB for extra power is not always needed. Some USB ports can push the drive with the data USB alone connected. Small, neat, compact, no wires. Just be careful when removing the Hard Drive; you could break off the LED to the front; but it's pretty strong (self tested)."
2,Great product with a flaw,"A very nice product that works great.... no video problems at all and the key switch works as advertised and much better than having to throw a switch on a box. It is nicely designed. HOWEVER, after using the item and then removing it and going back to a direct plug in of mouse and keyboard on my new Compaq Presario, the computer would not boot up unless I had the cables attached. I could not even get into safe mode with winXP. I had to go to a USB keyboard in order to get back into windows and work as before. This must be a flaw that no one else has reported since all others seem to continue using the IOGEAR GCS62 on two computers. Beware if you want it for only a temporary period."
2,Perfect gift foe an Auburn Graduate.,My son-in-law loved these cuff-links from his Auburn University! They are a good quality with some weight to them. This is a fantastic gift idea.
2,It inspired this business owner,"Mr Slutsky's book had many suggestions in it which I have put to very good and profitable use. Because of the suggestions in his book, I have secured a weekly column on the topic which my business focuses on and got a large newspaper to do an article on me and my business (with a fantastic response!). Thanks Jeff!"
2,The only playset from The Chamber of Secrets!,"This playset is not even in stores yet!(as of February of 2002) It is from year 2! Don't be fooled, the picture amazon.com has is of Hagrid's Hut. The playset includes the forbidden forest, platform 9 3/4, and Hagrids Hut, and it is the last playset to connect to the world of Hogwarts. Inside is the whomping willow, which can grab the Weasley's blue car, and it has a spider web inside with Aragog the spider. It includes a Ron and Harry little figure. It won't be available in stores till a couple months."
