Lable,Topic,Text
1,Have to give it a 2 out of 5,"I love GG! This is a bootleg gone public. Lousy sound quality with extra noises and stuff from the BAD recorder. GG is close to flawless though, which is why it gets a two. On spin? No comment..."
1,Didn't last as long as an incandescent lightbulb,"As other reviewers experienced, this drive was superb in its performance, reading and writing anything which could be thrown at it. In this sense, the best burner I ever plugged into my system. Unfortunately, as other reviewers also experienced, its durability is simply inadequate, making it a poor value for its price. Mine lasted 4 days beyond the end of the warrantee period. To their credit, the company still honored the warrantee, but only after considerable difficulty communicating with them. Only a computer tech friend was able to contact them effectively in order to make the arrangements -- not adequate support. I was without the drive for nearly a month by the time all of this got done.SIMPLY NOT GOOD ENOUGH."
1,Great while it lasted,"I agreed with the other reviewers and would have given this drive 5 stars if I had written a review earlier. It installed perfectly and ran faultless and quietly, for the first two months. Then it stopped working and refused to recognise there was even a DVD in the drive. The breakdown was sudden. It wrote a DVD and then it stopped recognising any disks. I tried it in another machine with the same problem so it is the hardware.I wont pretend that my experience is typical but it may have something to do with the fact that this is a cheap drive and maybe you really do get what you pay for. I'm not trying to put you off this drive but if you do a lot of DVD writing then maybe a better drive might work longer."
1,Received Defective Item,"We've learn the lesson. When we received the package we didn't open the box and test it! By the time we open the box to use the catridge and found out that it is defective, the warranty already expired! So, the seller refused to exchange it for us."
1,Low Cost but Terrible Quality,"There is a stripe running down the middle of every page, the ink is inconsistent (leaves streaks, dark and light spots) and prints some material illegibly.Tried a second cartridge with the same results.Contacted seller and their response was:""Unfortunately the problem may be that you let the cartridges sit for too long, as they do have a shelf life. t this point there is not much assistance we can offer""I suggest that they send cartridges that sat on the shelf too long or they are just poor quality. I bought these in November and used them in March - a 4month shelf life, hmmm, that's not mentioned anywhere - in fact on end of the box there is a ""Use Before"" date that is blank.I'll never buy these again."
1,Review of Brother Black Toner (TN-350),Brother Black Toner Cartridge (TN-350)I ordered the Brother Black Toner TN-350 and received TN instead which does not fit in my printer! Reported this to Amazon - but have not had a response! Unhappy.
1,Do not ask me to review,Please do not ask me to review.I did not even get the product.I had to wait a month to file a complaint.Now I have to wait 2 weeks to get a response.This is utter nonsense.You took money out of my credit card.Shame on you for acting so slow.Kick that seller out of you site.The seller does not even respond.
1,Extremely Bad - Don't Buy This Book!!!,"I saw this author interviewed in a documentary about Edgar Cayce and I was intrigued enough to buy the book they referenced. Boy was I disappointed. There are hardly any direct quotes from Cayce and Thurston's interpretations are really ridiculous. Did you know that Atlantis didn't exist in the past and Cayce was confusing the past and the future, so his memories of Atlantis are actually predictions of a future civilization? Ideas like this and the fact that the book is really about Thurston's own ideas and not really about Cayce at all made me really angry that I wasted money on this thing."
1,"Does not deliver, in any way","This book does not live up to its title. No, I'm not a sceptic when it comes to prophecies, astrology or any other paranormal subject for that mather. But not a naive believer either.Therefore, reading this book, I couldn't help but finding myself being more and more desillusionated turning each page. The author hardly mentions any predictions. And when he does, he sticks to vague generalities.Certainly, Cayce explained that future events are largely dependent on human choice, therefore not set and outlined, but dynamic and can to some extend not be foreseen.Yet, I for one would at least have expected facts straight from the 14+ thousand predictions in the great Cayce archive. But you will not find any of that.So, if you want to read about Cayce's predictions, don't buy this book. It's a waste of your time and money."
1,A bit disappointing,"I should have known not to order a book that lacks the 'look inside' feature, but Ortho books are usually very good. This book was disappointing (to me, at least) for the following reasons: too basic, not enough information, and it does NOT include photograghs of the finished landscapes. Mostly I just do not like the illustrations--fuzzy chalk drawings that are hard on the eyes and lack definition. Selected ideas for building fences, pergolas, etc. consist of simple line drawings and no detailed instructions. Sorry Ortho, I've seen better."
1,Very few if any actual Cayce predictions,"This is an inspirational book a la Thurston. For me, the problem was that about 95% of the book is the author's words, with a very occasional quotation from Cayce. Also surprisingly, very little in the way of actual predictions for the 21st century. Not sure how the publisher arrived at the title for the book, perhaps to sell it?"
1,He has done better in the past,"I saw him do another stand up video where he talks about going into Harlem to visit his black girlfriend. That video was great, but this one was just average.I like it that he has an edgy style. But there are at least 2 times in this video where he sounds too angry or too annoyed.He definitely has the talent and creativity to be better and even be innovative. This video is not a good example of his talent."
1,Great but not durable,"I bought this DVD burner in Oct 05. It worked very well for the most part. Sometimes it had trouble reading DVDs and I had to open and reload several times, but when working, it worked great. Then in Oct 07 it stopped opening. I could hear it trying to get the drawer open, but it remained closed. I did not want to have to replace this after only 2 years, but I have no choice. I would not buy this item again nor would I recommend it to others."
1,FAulty product,"I've ordered, from Amazon, this product before as replacement cartridge for my Brother printer and never had a problem until this time. When I replaced the out-of-toner cartridge that was in my printer with this replacement cartridge the replacement failed in about three weeks time. My printer indicated it was out-of-toner. I removed the cartridge two times and shook it each time thinking that it would solve the problem. It did not. I telephone Brother and followed the representative's instructions and found that the security tape on the side of the cartridge had been ripped before I received it and was the cause of cartridge failure. I ordered another cartridge from Amazon to replace that one and installed it in my machine. Hopefully it will not fail me as the security tape on the side of the new one was intact."
1,"On-Stage Microphone 13-inch Gooseneck, Black","This gooseneck, after having been flexed a mere handful of times, began to break: inferior quality! The whole point of a gooseneck attachment is that you can bend it, and this one did not like to bend."
1,Far Too flexible for use with a professional microphone,I purchased 2 of these items to use with my band for the guitarists. I was disapointed when I mounted a Shure sm 58 mic on it and found that the goose neck would not stay erect. These are made far too loose and flexible for most professional mics. They may work on very small and light weight units but for my needs they are totally unuseable. It would have been helpful to include the suggested weight that this goose neck would support in the sales description. I wasted my money. Don't waste yours. Perhaps viagra would be helpful ;-)
1,Flimsy but I made it work,This gooseneck is pretty flimsy. I ended up filling it with epoxy in the shape that I wanted it. Now it will hold anything.It gets the job done though and the price was right.
1,They are ok,"Soft and pretty sheets, even though they are not queen size, they run smaller and more after first wash, something that never happened with any other sheets I've bought so far. The color gets lighter in time. They are ok."
1,"Very different, but interesting.","This was a strange and confusing book. It's about Frank Yerby, he is on his deathbed, and really unhappy about it. He's a writer who's books don't have readers, and the characters of his books aren't happy about that either. I thought was a really odd book.The book did wander, and even though I understood the basic message I just couldn't really understand it all. Maybe it is for greater minds than mind I don't know."
1,Confusing,"This is the second novel I have read from this author and while I enjoyed the first one, this one simply confused me. Stovall takes a look at one of his favorite subject matters - the role of black people in society and in particular, in this novel, their victimization - through the eyes of a ""somewhat"" forgotten novelist - Yerby who has been on record as saying that black people are responsible for their lot in life.Yet, at the same time, they are asking Yerby to recant his words or they may never exist again.I found this book highly confusing to read and although I got the basic message coming out of the storyline, it felt as though the role of Yerby was overextended greatly.I am still scratching my head on this one."
1,The least accessible of all Residents recordings,"The Big Bubble has an intersting, if not original, concept: a musical group makes recordings in their native language in defiance of the law, and become a hit. Is this a dream the Residents have for themselves? This is a part of the entire Mole legend that the Residents dreamed up, and have used in four previous recordings (Mark of the Mole, The Mole Show Live, The Tale of Two Cities, Intermission) However, as a whole, the Big Bubble is not a success. Using some of the most unlistenable singing the Residents ever released, and some of the most unlistenable music. I say this from the angle of a long-time (since 1978) Residents fan.There are some interesting cuts, especially Cry for Fire (which can be best described as bad sex followed by an incredible orgasm) but get this only if you are a die hard - gotta have it all fan."
1,Terrible.. One of the worst albums ever in history,"I bought this album when it first came out on vinyl. When I got it home, I was gravely dissapointed. I had been enthralled with The Residents up to that time, and absolutley loved The Mark Of The Mole and Intermission. This album came out and I was expecting the Mole Story to be further advanced, and all I got was just a bunch of wordless moaning and groaning and gibberish that sounded like it was coming from an person suffering from autism along side of some of the worst song lyrics of all time. I immediatley sold it back to the store."
1,Live,"I bought this album thinking it was a greatest hits compilation. I was wrong. It's a LIVE ALBUM. I have not listened to any more than what it took to hear the applause in the beginning of all the tracks, so I can't vouch for the quality of the recording itself. But if you are looking for the original hits, don't buy this import! Sedaka fans might want it for their collection, I don't know, someone else might want to write a review of the quality of the performance. But if all you want are the original recordings of the latter part of Sedaka's career, look elsewhere. You will not find them here."
1,New formula is not better than before.,"I've been using Ciment Anti-Usure for five or six years now. I have fine, thin hair and it was the perfect conditioner for me. It made my hair soft and manageable with no flyaway static problems, even in the dead of winter. I just started using my first bottle of the new formula about a month ago, and I am not a fan. My hair looks limp and greasy, yet I have so much static going on my bangs constantly stick to my face. My natural wave is hardly noticeable with the new formula."
1,Sedaka Sings Elevator Music,"Listening to this, I truly realized that Sedaka made his greatest contributions to pop music in the '50's and '60's. Aside from the few hits (Laughter in the Rain, Bad Blood, Lonely Nights, etc.) he produced in the '70's, Sedaka's M.O.R. ""Second career"" mainly produced songs for the Geritol set. Buy yourself a good early Sedaka compilation (Sings the Hits comes to mind) and give this one to your grandparents."
1,Do not bother. Cannot hold the weight. Flimsy!,"This product is terrible. It cannot hold the weight of any microphone over 1 lb, and I would question that, based on your angle of use. It is terribly made with flimsy construction and I do not recommend its purchase. Look for a more sturdy built construction gooseneck mic holder. They are out there, it's just not this one. Fortunately Amazon was great about their return policy, which I appreciate. Thank you Amazon for at least having a positive return experience."
1,Received a refurbished cartridge,"When I bought the Brother TN350 Black Toner Cartridge, I was under the impression that I was getting a new cartidge (probably due to the picture), but received a refurbished cartridge. Other than that, the price and delivery were good."
1,Disapointment Pirate Ship,"Well I too am disappointed in this purchase. I bought this for my son's 4th Birthday and I have been putting it together ever since! The pieces fall off, nothing stays where it should. I understand the concept of building and rebuilding but it should be because you want to not because it keeps falling apart. I am seriously thinking of super gluing all if the pieces together (except the pirates). I can't believe that Fisher Price would make something so flimsy that you can't play with it."
1,Poor Quality,I would suggest paying a little more and getting a better quality toner cartridge. Since installing it I have been getting black spots and specs of toner all over my printouts and copies. I would not purchase these again.
1,Too terse and academic,"This book tries to cover far too much in too little space, much of which is taken up by examples that are not that great and lack any type of highlighting, arrows, boxes, etc. that would help you quickly find the relevant pieces.Regardless of whether the author had a page limit or simply favors a terse and academic style, the net result was that I had to seek other sources to understand numerous points, and they universally explained the topic much more logically and in an easy to follow and, more importantly, read fashion.All in all a very painful read."
1,Semi-techie's evaluation,"This book tells you what you need to know. However, it is a bit of a hard slog because it doesn't tell you why you need to know it. It also throws in obscure acronyms and not only expects you to know what they stand for, but what those protocols/standards/programs imply. Yes, you can learn all you need to know about SQL schema, (and more than you need to know - without telling you why you need to know it, you don't know what to skip), but it is a little more painful than it has to be."
1,Sloppy editing an embarrassment for O'Reilly,"This book appears to have been thrown together overnight, without the attention of a proofreader or content editor. While I can't say it's actually missing important content, it is certainly the sloppiest O'Reilly book I've ever read. The very first example (on p. 6) is a glaringly ill-formed XML document (the second line contains spurious junk text, as if from a word-processing error), and it just continues from there. The book contains numerous apparent ""cut-and-paste"" errors of this kind, as well as evidence that global search-and-replace operations were hastily performed on the entire text without subsequent proofreading. What's up, O'Reilly?"
1,An Editing Nightmare,"This book had potential to be a definitive guide to XML schema. This is not the kind of book you can pick up and read cover to cover (unless insomnia is a real condition for you, in which case this book may help). It is, by no means, a tutorial of XML schema - or even a reference. It's more of an exploratory academic walk of the W3C recommendation and all of its foibles and nuances. There is wealth of information in this book, if you can glean it out from inbetween the droning prose and historical diatribe.O'Reilly should be shamefully embarassed for ever letting this book go to print in the condition it is. It is replete with errata, typos, and slopped together examples. This book is destined to frustrate those new to XML schema. An uncharacteristicly poor level of quality for O'Reilly."
1,Doesn't Work,I'm sorry I wasted money on this. It didn't even slightly work. It just made my glasses kind of greasy with black streaks before it was completely wiped away.
1,Didnt work,"This item does not come with a buffing cloth, and did nothing for the light scratches on my eyeglasses or sunglasses."
1,Not quite as expected,"I ordered a remanufactured Brother TN350 Black Toner Cartridge. A cartridge arrived quickly and works in the printer.HOWEVER, the cartridge which arrived was not a remanufactured Brother cartridge, but rather a third-party cartridge. I specifically chose this item because it was a Brother cartridge, not a third-party cartridge.Since the cartridge is for my daughter in college, we do not have time to hassle with this issue, so for pragmatic reasons I have accepted the cartridge. However, the advertisements and picture are not correct."
1,Best of Dick and Dee Dee,I was not impressed with the sound quality of this CD. I did not think that it sounded like the original. I would not recommend this product.
1,"I did not want to, but I did read it.","The review title says it all. I believe for one to get an accurate perspective, one must read both sides. Anyone living through the Vietnam Era and serving in the military through this would truly like to burn this book.Those that were on the ""peace"" side need to be thanked. Thank them for aiding a people killing 58,000 American soldiers, thank them for helping kill 4.5 million Laotians, Cambodians and Vietnamese. It was there peace movement that forced the politicans to abandon these people and leave them to be slaughtered by the enemy they aided.The activists and supporters of the peace movements have the blood of these millions on their hands. This book needs to read by all those that want to know and understand the peace movements of that day and this day are nothing more than appeasements to those wishing to destroy the freedoms so many have died for.This book is trash."
1,ali wants nelly's spot bad,ali never had a serious fanbase cept for being affiliated with nelly so if you';re a serious goodie mob or gipp fan pick it up ugk pops up on here troo so get it only for that too bad st. louis rappers are'nt getting much play I'd rather spend my money on murphy lee's project.
1,Not as advertised,The item I received was NOT CORRECT. Wrong picture posted!!! I couldn't use the product.
1,Not worth the money,My 5 year old BEGGED for this toy for Christmas. He has only played with it maybe 3 times in 4 months. It comes apart too easily and my 5 year old can't put it back together himself.
1,A very poorly written book,"The ""Author's Note"" irritated me (check out the first and last sentences) and the first paragraph of the book irritated me even more. This goes beyond writing style or inventive wordplay ala Riddley Walker or Feersum Endjinn - Foy seems oblivious to the basic rules of grammar. After reading the first page I flipped through at random and it didn't get any better. This book got thrown across the room, then picked up and put in the bin. However judging by some of the other write-ups it contains some very good ideas. So read the first page - if this doesn't bug the **** out of you maybe you'll enjoy it."
1,"Written for the academic world, not the business world","I'd advise that this one be avoided if you're looking for practical methods of actually managing design alliances. The entire book is really just an exhaustive definition of the concept of design alliances, with detailed descriptions of the various types that exist. No real practical information for the manager or executive looking for help with any one particular situation."
1,More appropriate for 6yrs & up...,"My son received the Imaginext ship for his 4th birthday. He's a dextrous little guy, but this ship does not stay together despite help from an adult. The ship and accessory components are packaged in sections and must be assembled. Much of the assembly was easy enough for a child to do but, the toy wasn't fun because the sections of ship so not stay together when playing with the ""finished"" item. The masts fall off, and the main peices of the ship separate when you don't want them to. My son was so discouraged he asked if we could return it for a toy that ""works right"". We bought Black Beard's Pirate Ship by Play Mobil and my son is very happy with that toy. He needed more adult help with the assembly, but it stayed together once it was assembled and now he's having lots of fun playing with it."
1,wouldn't buy this ship for kids younger then 6,my son got the pirate ship for a gift and he is 4 years old. he got so frustrated with it because all of the pieces kept folling off. the mast wouldn't stay up for anything! and the nets to the mast would not fit. I don't know what fisherprice is thinking with this toy line but this one was horrible.
1,Don't Order This!,"This ships without the Curriculum Starter Cards. I ordered and received an 11 page guide to using the Starter Cards. I was told by the customer service rep at Amazon that they were sorry I misunderstood the contents. They advised me to return the item, which I did. I am trying to save anyone else the frustration of getting a guide to using nonexistent cards for $40."
1,never received book,I've been in contact with the book supplier and have waited now for a month for the book. Each time i write them they tell me to write back in a week.Very disappointed to not have this gift to put under the tree.
1,Terrible toy,"I can remember when Fisher-Price toys were a whole lot friendlier...all the characters have weapons and ""fierce"" expressions. A friend of mine bought this for her three yr old daughter because she saw the box and begged, then after it was opened, the girl refused to play with the ""mean people"". The concept is good, but why does it have to be so violently oriented?"
1,Falls Apart Constantly,"My three-year-old boy loves pirates, so I was thrilled to get him this ship. Unfortunately, the ship took me a while to assemble, and comes apart instantly. The three pieces of the boat separate constantly, the rigging and railing pops right off, and the masts regularly fall over. There are a lot of small pieces, which are OK for him, but could be a problem for other young children. He still likes the boat, but playing with it requires a fair amount of adult assistance as it is constantly falling apart. I personally wouldn't even purchase it for an older child, but maybe you would be OK in the over seven-age group."
1,Not OEM genuine Brother TN350 Cartridges,The title on the description and the picture leads you to believe that this is an OEM genuine product but it appears to be a remanufactured product when it arrived. Do not buy if you want orignial OEM Brother TN-350.
1,Toner Purchase,I did not receive what I ordered. I ordered Brother toner and got generic recycled toner cartridge. Will never purchase from this company again.
1,Buyer Beware,"Printer says ""No toner cartridge"" when it is installed. The old cartridge works just fine except that it is out of toner so I KNOW it is the cartridge. Because the sticker got scraped off by me putting it in the machine so many times and trying to get it to work, Brother will not accept the return. I feel totally ripped off.....$44 for NOTHING! I think I'll just buy a different brand printer!!!"
1,Falls Apart Constantly,"This item is horrible. It falls apart constantly. We tried hot gluing and superglue, however, NOTHING works. Even our 4-1/2 YR son has told us to throw this out he is so frustrated.Part of appeal was you can take Imaginext items & reconfigure them, great concept. However, no matter how you configure them, they ALL fall apart.During assembly notice they do not ""click"" as you would expect. Pieces never lock together, even with the bottom ""base"" pieces.We resorted to putting all the Imaginext on a table for him to play, however, flat surface, bumpy surface, any surface, it falls apart.(...)When a 4-1/2 YR wants you to throw out his toys, somethings wrong!"
