Lable,Topic,Text
1,The Liberace of Murder Mysteries,"Any guy who describes ordinary, everyday headlights being turned off as ""the extinguishing of two vanilla flames,"" and admires himself for his powers of description, shows very little taste or judgment as a writer. All his books are clotted with these inappropriate flights of fancy-ness (he's the Liberace of murder mysteries), but this one is icky clear through. His characters are real-ish, if tiresomely self absorbed and never quite likeable (his own alter-ego, the doctor, is tediously PC and selfconscious), the plot potentially intriguing enough, when he gets to it, even the dialogue works much of the time, but, as usual, the endless detail of whether you turn right or left to get to his favorite hangouts, the florid descriptions of place and vista which never really come off, those go on for pages and chapters and make you forget whether you ever cared who done it and how come. Bleh."
1,Awful,"I rented this thinking that it was a documentary. Boy, was I wrong. It's edited like a music video. It is shot as if Braddock, his wife and family are all being interviewed during the actual events of Braddock's life. ( Ie. Braddock saying"" I know I ain't gonna get anudda chance like dis"" or a promoter saying ""Dat night he found anudda reason ta fight. Ta save the life of his wife and kids."") Ugh. The film by Ron Howard shows Braddock and his wife to be brave, heroic people. This thing by ESPN makes them out to be self pitying losers. Skip this and rent the Crowe film."
1,disappointed!,The product arrived damaged; I returned it asap! It seems that too many businessmen out there don't appreciate the good business sense of properly packaging and protecting the products that they sell or bother to make sure that they're in perfect shape to begin with!
1,Not what you think,"I received this today and instead of what is pictured I received a green rock and a yellow rock. They were not multi color like the picture and there is only one per order, not 3 like pictured. Also it states on the front of the package that it is ""the rock floats"" yet on the back in small print it reads ""use caution near water--this product sinks like a rock!"" Also it states on amazon for romping and chomping but also in the small print it states "" the Rock is NOT a chew toy. Excessive chewing may damage the product"". So I am confused what is this for? Well we also took them out and played fetch. They each lasted around 3 throws before they decided to bust down one of the seams."
1,Dog chewed right this,"Sorry. We have a Cattle Dog and she destroyed this in record time. If you have a ""El Destructo"" dog, you're better off with Nylabones."
1,Pretty Good,I love New Orleans. This book is pretty good. However. It needs either more recipes and less pictures or vice versa. It's trying to do too much and kind of fails to do either.
1,Meh.,"I've read most of his books, and am a fan, but this one just didn't cut it for me.I guess, like others, my biggest beef was the Emma character. What little character development Mr. White did resulted in little more than a whiny bitch.Also, the high-tech stuff left me thinking that perhaps he is thinking about writing in the Sci-Fi genre. Meh.I understand that Mr. White will be ending this series of books with the next one after ""Line of Fire."" It will be interesting to see what he does next, because I really consider him to be a talented writer."
1,Not much here,"I've listened to about half of the audiobook on CD and it does absolutely nothing for me. Very general information. Too much focus is on the ""what"" to do, but not on ""how"" to do it. I wouldn't recommend it to anyone - male / female, young / old, etc. There are much better books and audiobooks out there."
1,Disappointed,"I have read all of Stephen White's books. This was the only one that I really didn't like and struggled to get through. Lauren was just too pathetic, the plot twists were absurd and even Alan (my favorite character) was a bit hard to take. If you're a Stephen White fan you have to read it just to do so, but definitely check this one out of the local library rather than purchasing it. If you're not a White fan, don't bother with it."
1,spurious logic,"This is a book rich in logical flaws, wrongheaded conclusions, and outright mistakes. ..."
1,Fame Over Acting.... Again,"I'm not going to lie, I only rented this movie because I was curious about Batista's acting skills. And this is the reason it's getting 2/5 stars.As far as the storyline goes, it's a pretty typical 'seek and revenge' setting. Movies like this seem to never get old to me though so that was fine. The only thing that completely killed it for me was Batista's acting, he could not get away from his bad-boy wrestling act the ENTIRE movie which is fine for 5 minutes in the ring but dragging it out for an hour and a half was dreadful. He was dull, emotionless, ""too cool for school"", and looked like he was staring at a wall in his dialogue - it never changed not once and it got old.If they would've gone with a different actor for the main character this movie would've had great potential, but they didn't so *insert fart noise here*."
1,AWFUL,ONE OF THE WORST MOVIES I EVER VIEWED. FROM THE CASTING TO THE DIALOGUE TO THE ACTING TO THE PLOT TO THE ENDING. THERE IS NO CHEMISTRY BETWEEN THE TATTOOED HULK AND THE PETITE BLOND. THE HULK CANT ACT. HIS LINES AND PHYSICAL MOVES REMINDED ME OF A HIGH-SCHOOL PLAY. THERE WERE TOO MANY BAD CHARACTERS MAKING IT DIFFICULT TO KEEP THEM SEPERATED AND MOST OF THEM WERE ELEMINATED BEFORE THEY HAD AN OPPOTUNITY TO DEVELOP THEIR ROLE.
1,This was boring.,"It did have a bit of skill, but honestly I could have slept while reading it if that was possible."
1,LET'S HOPE HE'S GOTTEN IT OUT OF HIS SYSTEM,"I suppose every author writes a clinker now and then. After reading and loving the previous four books, I was stunned at the outright dullness of this ""effort."" I never felt any real suspense, nor did I find myself wanting to find out who the ""bad guy"" was. I didn't even care when his identity was revealed. At no time did I feel that Lauren was in any real trouble or that Emma might actually come to harm. I am confident that this book was a glitch, and that future White volumes will return to his normal high standards. I bought this one, after having checked out his previous four. A waste of money, to say the least."
1,Horrid,"The acting is so completely bad, it's actually a tone for the whole movie.New York accents all done by non New Yorkers and done in the worst way, all in uniform.Awful. NO STARS"
1,so so,"I won't go into detail because others have, but although this book was well-researched and had many plot twists and turns, it was still incredibly boring. It was my first Stephen White book and I am not sure if I will read more.My other issue was with Emma Spire - her character was not developed enough. It was not clear why the media would be so obsessed with her other than the murder of her father."
1,Food review,It is very mild and a bit disappointing from the sorghums that I remember from years past. I will not purchase this brand again.
1,"Weak story, weak characters, weak book","This was my first SW book and probably my last. The plot was interesting for about 30 pages and then simply stopped being interesting. Unbelievable characters - I hate it when the protagonists in a series have earth shattering, life threatening experiences in every book - and the McGuffin held my interest for about 0 seconds. Too much put into too many pages. Additionally, what drove me crazy were all these similar sounding names of the main characters (Casy - Cozy, Sam - Scott). And there were too many characters, 2 policemen, 2 lawyers, very confusing. The only reason I gave it 2 stars is the fact that I read it completely and didn't throw it out after 50 pages as I usually do with duds."
1,Poor taste,"I was really disappointed with the Sorghum we purchased. We have been users of it for over 50 years, and have previously had bought it from other vendors, usually from Indiana. This product, though sweet, did not have the expected molasses taste. It was just too bland.Walter C. Daniels"
1,Not your grandmother's sorghum,"I ordered a quart of ""pure sorghum syrup"" and it was delivered in good condition, packaged well, and arrived quickly to my doorstep. That is where the compliments end. This was not sorghum. It was pale and sweet with a weird aftertaste, and had a taste more like karo corn syrup than anything that is like sorghum molasses. I was very disappointed and had to throw it out since no one would eat it. If you like karo corn syrup on your pancakes this is for you. Sadly not for me."
1,Not what was expected!!,"I searched for a long time yo find sorghum syrup. After receiving my JUG of Barry Farm sorghum syrup, I still have not found it!! It was totally tasteless and goopy. I spent nearly fifty plus years in the food and food relatedindustry, I've experienced the very best and a good deal of the worst, this product belongs to the latter...enough said!"
1,Sorghun not sorghum?,"The product was cloudy and pale, not dark and clear like true sorghum syrup. The taste and mouthfeel was more reminiscent of gum acacia or gelatin. I was very dissapointed and discarded the material as unappetizing at best. I found another supplier who is a member of the sorghum syrup producers association and displays their logo."
1,late and short,I found Barry farms through amazon and ordered 46 oz of sorghum from their website on 6/25. After my third email requesting a tracking no. I received an email from postal service stating that the product was being mailed on 7/2. No responses directly from Barry farms. I received my order and it was 32 oz quart jar and my invoice states 46 oz. I emailed them again.
1,Stick with MKSAP,"The answers to the questions are the strength of this book. The questions themselves are much less clinical than the scenarios seen in MKSAP or Case Files. Overall, the book is closer to Step 1 prep than Shelf or Step 2. With the IM Shelf being one of the most difficult to finish in the alloted time, practice with clinical vignettes--as opposed to matching and 2 line scenarios--is more realistic and high yield. Buy MKSAP and Case Files instead."
1,A Genuine Flop!,"The author himself must have been on ""remote control."" The book was simply dull and boring from start to finish. There was so little in it to keep you interested that by the time you reached the end, you forgot what happened at the first - nor did you care! I waited anxiously to buy it, then wished I could have taken in back for a refund."
1,House of the rising sun,"It was an ok movie but I'm not use to seeing Bautista get his but kicked like he is nothing. I expected more of an action role, and this was more like a drama suspense type movie"
1,broken battery connector,"I had the same experience as two other reviewers. Directions for removing and reinserting battery ribbon cable are very unclear, especially the part about rotating the tool. I rotated the battery connector right off, and I am usually pretty handy. Useless Ipod now."
1,Disappointed,"I am using this on my iMac and it works... sometimes. I bought it to charge/sync my iphones with the idea of charging them when the computer was logged off. Not only doesn't it work that way but sometimes it has to be reset to even ""see"" what is plugged into it. Sometimes during a sync it will disconnect or sync very slowly. If you are going to use this hub like I am, move on to something else."
1,Ugh.,"The problem with this hub is that it has horrible latency. If you're planning on plugging a thumb drive or external hard drive into this, forget it. If you're trying to run a keyboard & mouse, it'll probably work fine. Go from the point of view that anything with an extremely low data rate will work just fine, but anything else is going to have major issues."
1,Mold,"I received the Royal King Brand Ginseng Royal Jelly 30x10ml that I purchased in the mail today. One bottle was cracked and others were empty. There was no fresh liquid leaking in the package just the old dried stains so it must have leaked a long time ago, not while in transit. There was also dirt, filth, mold and cobwebs growing on the bottles inside the package."
1,not pleased,bought this for a cross draw. holster is a little bulky. the draw is stiff and catchy with no tension adjustment. going back the shoulder setup. would not recommend.
1,Battery-Eater,Bet the designed circuit or the one that I bought has problem. It is a battery eater even it is off. Every few days batteries have to be replaced even it hasn't been used if I don't take the batteries outta it. So far my battery cost more than this camera.
1,POS,This system is a complete POS! I have had less than a year and have had nothing but problems...and HP customer service..the worst. If you have a couple of spare hours to take care of problem and dont mind being transfered from India to Houston to Costa Rica to PaloAlto all on the same call and still got nothing accomplished. Customer Service fails to listen to their customers and forget about anyone returning your call. There are some serious hardware design problems with this unit or they got [...] parts from their suppliers.
1,Camera does not power on,"When I opened the camera and took it out of the box, I inserted the batteries and the camera is not powering on, it does nothing at all. What do I need to do?Best regards,"
1,blurry pics in macro,"i received this camera as a gift from another amazon customer and although i found it easy to figure out, it came with NO USB cord so i had to purchase one to go with it. i also take alot of pictures of rescued animals and found that every picture i took in macro of newborn pups, they were all blurry. the only pictures that came out clear were the ones i took at a distance. i even went as far as downloading the manual to see if there was something i may have been doing wrong, but i had all the settings as instructed and it STILL took blurry pics up close. returned this camera and got a better one. i do not recommend this camera if you are looking for pics with detail and clarity"
1,Anyone can find a group of opposing views,"Specifically as a movie, it was OK at best. My problem with any movie as this, it's easy to be the Monday morning quarter back and state what could've, should've and would've. If I had the time and money I bet I could find the same amount of people with a 100% opposing view to this movie. No doubt, war is ugly. It appeared way too biased for me. The agenda appeared to be more of a smear campaign."
1,Extremely short lifespan: 2 died on me,"These were good monitors for my video editing for about a year until one of them developed a hum/buzz. I researched and found out that apparently this model has some kind of power/capacitor issue and dies quickly. I bought a replacement and 6 months later another speaker started buzzing! Moreover, M-Audio/Avid has terrible customer service, I do not recommend these at all."
1,Not impressive,"I'm an M-Audio fan, I love their pre-amps, but these really miss the mark. There is a huge lack of bass which has lead to many problems with mixing my music. When I showed the re-engineered sound to my director, the results weren't good. I mixed the audio flat but it played with more bass than hip-hop music. These were a big disappointment. Save for awhile more and treat yourself to a good pair of monitors."
1,Buyer Beware,"I purchased these monitors through Amazon.com in November of 2009 and was impressed with the value and the sound quality, until the right monitor crapped out two months later (January 2010). Seems to be the on/off switch. M-Audio assesses a support/tech fee after 30 days of ownership and are not at all supportive. The seller has yet to contact me about repair, or replacement. I have now read (wish I had before my purchase) about identical problems with these monitors. I would obviously not recommend these, or any M-Audio products to anyone."
1,Cheaply built... Just google them,"Im not using these in my studio... Rather, for my TV sound system. These actually sound surprisingly good... They'd be great if MAudio didnt cheap out on components. Just Google the capacitor issues these things have. Its a well known issue that causes one or both of them to go dead suddenly and the company is no help with helping fix the issue. I've bought 3 single ones to complete my pairs (and conveniently the company doesn't sell them single) I'm about to just throw them in my junk room and buy something else"
1,Good for Light Use,"I am a heavy duty mechanic by trade and I bought this for use in some of the smaller jobs at work. Well, it broke in less than a month. The drive tip snaped off while I was tightening down some fuel pump bolts. I really do like the design and it is easy to change from forward to reverse with one hand, but I thought the quality would have been better. I think the wobble head design seriously weakens the drive tip. I guess I should have bought the standard tip model but who knows. It would be great around the garage at home but I wouldn't call it a professional grade tool."
1,"Vague, Verbose, Quasi-scientific","The explanations in this text are not carefully worded. If you're actually trying to learn concepts and understand the material in any deep fashion this text will confound you and leave you with a shallow overview with some ""tools"". They throw up some formulas and wave their hands around a lot. When it comes to precise explanations and scientific concepts, this book is lacking. It gives you the vocabulary necessary to recognize the topics and ideas, but not the depth of knowledge necessary to actually UNDERSTAND and assimilate the science on any deep level.Overall, it's a sloppy text that does a sloppy job of introducing this topic."
1,With pleasure.,It is always amusing to come across a work that favors form over content. But perhaps scholarly books are not really designed to be read for this kind of entertainment - I have the feeling that someone is missing the point here.
1,Do not recommend this product - too small and leaky,"I was expecting this ball to be fairly large since it was stated to be 65 cm. However, I found this ball to be the smallest exercise ball I've ever seen once fully inflated. All the different brands of 65 cm balls at my gym are fairly large, so I expected this one to be similar in size. It turns out this ball is smaller than any 65, or even 55 cm ball for that matter, that I've ever seen (it looks like it could be rated at 45 cm). I'm relatively short at 5'5"" but this ball was far too small for me. Although the ball is made up of what feels like higher quality material, it does not hold air in very well. Without any use of the ball, it is able to remain firm for about 1 week. I was fairly disappointed with this ball since it looks and feels nice, but is way too small and leaky."
1,WORST Peanut Sauce EVER,This doesn't even taste like peanuts! It's just vinegar. The people who made this crud have never tasted real THAI peanut sauce. DO NOT EVER BUY THIS!
1,This is almost laughable... Now I've seen it all.,"The christian agenda has as its primary aim to ""trump"" the rights of all other groups, especially those of people who aren't exactly the same as them.No gay person I have met has ever said christians shouldn't be allowed to get married, or that it would be okay for a christian to be bashed in the street, or made unemployed because of their faith. However, christians never miss an opportunity to express the opinion that it's okay for gay people to be treated this way. You get on with your faith, and leave us alone, and we will be happy to do the same.What a pile of ridiculous, paranoid, rubbish. Open your eyes!"
1,"Silly, Shrill, and a little bit Funny","If I didn't know that some folks would actually believe this silliness, I could laugh more at this book. How sad that serious, REAL Christianity is continually given a black eye by people like this. There is virtually nothing here based on fact, and virtually nothing based on the Bible. This book represents the worst kind of misreading of Scripture and current events. Only a moron would take this stuff seriously. The only positive thing that can be said for it is that I did laugh out loud a few times."
1,It should be called,The Christian Agenda: We must brainwash more people. This book is full of propaganda and lies. The authors should be ashamed.
1,Not my type of man,"The book wasn't badly written but I just couldn't get into it. Other reviewers have covered the plot so I won't.My problem was the hero. I'm sorry but I want to WANT the hero and I didn't in this book. The first time we meet him the heroine herself says he is ""not handsome or agreeable in anyway"". When the author is describing what he looks like I thought she was describing some villian we would come to know, not the man the heroine (and myself) are supposed to fall in love with. He is described as old with graying hair, a huge scar on his face and a limp. This doesn't make for a very sexy man. I'm sorry but my husband has his own flaws, I don't need to read about somebody else's husband's flaws too!!"
1,Major Disappointment! =(,"- I stopped at page 100. And ""ditto"" on Greer's attributes already mentioned here.- I've really enjoyed Julia London in the past, (""The Hazards of Hunting a Duke"" was wonderful!) but ""Greer"" was *so* ridiculous: winey, prejudiced, hypocritical, and downright stupid! Her actions, her attitude, even her dialogue! I honestly couldn't find one thing I liked about her.Greer takes Percy, a complete stranger she has met on a public coach, at his every word, for absolutely everything he says, simply because he is smooth and polite and knows how to lay on the charm; where Rhoderick is quiet, honest, albeit, somewhat suspicious and brusque. (And who wouldn't be if some stranger showed up on your doorstep and demanded money? )- I thought perhaps it was just a mood so I put the book down and tried again a couple other times to read it. Nope! No better! I can only recall one other time I have ever put a book down and not completed reading it. This was very disappointing for me! =("
1,This Book Stinks,"Read pages 114 through 116 of this book and double over in laughter at the stupidity of ""historians."" Savor the scorn the author heaps on Fawn Brodie for daring to call out the obvious truth that Jefferson had a LOT of SEX with his slaves. Oh, the high brow elegance of Cunningham's attack! Oh, the elegance of his reductio ad absurdum! Weep at Cunningham's ridiculing conclusion ""The evidence indicates that any Paris romance between Jefferson and Hemmings belongs in a work of fiction, not of history.""This is enough to give you hemmeroids from laughter! But contemplate the shame of wasting your entire career on painting a picture of the ""PURSUIT OF REASON"" by the demi-god Jefferson only to have DNA prove that YOU were the one guilty of POMPOUS NEAR-RELIGIOUS FICTIONAL SELF DELUSION. Imagine being the historians who missed the CENTRAL FACT OF JEFFERSON'S WHOLE SEXUAL PERSONA.This is sweet irony that is too delicous to pass up. This book smells. Buy Fawn Brodie."
1,toxic ingredients- VERY unhealthy...get another brand,"This product contains sodium benzoate aka ""benzene"" ... it's been proven that benzene destroys the immune system. In fact without benzene in a patient AIDS can not thrive. If you have taken this toxin you MUST detox it out of your body by taking vitamin b-2 (www.lef.org is a nonprofit organization that sells the purest vitamins and publishes the absolute LATEST scientific research) For more information on benzene please read The Cure For All Diseases by Dr. Hulda R. Clark or 'The Cure for All Cancers'. Second , vegitable oil is one of the top causes of heart attack in the United States and it is absolutely forbidden in your diet PERIOD> For free information on vegitable oil and other scientific research on various health subjects call 1-800-226-2370."
1,False Representation,"This book was advertised as ""Like New."" When we received it, the book was full of underlined text (in pen!) and check marks."
1,"Hate to burst your bubble, but.. . .","I was using this as a seat at my computer desk, and unfortunately, it got a slow leak within a week.Pumping it up again did not help, though it is possible I simply received a defective item, or my [persnickety] cat took out its aggression on this ball while I was away.That being said, I CAN tell you that using it as a seat will offer you a good core and stability exercise. I was enjoying the subtle, but constant workout of my abs and lower back, which is why I was so disappointed when it deflated."
1,"I liked the color very much, but not much else.",I think if they didn't have a sandal foot the hose would be a lot better. Perhaps my feet are too small to fill the sandal foot part though it didn't appear that way but once i put my pumps on the sandal foot started to bulk up and it looked like sagging skin. The hose also sagged at the legs just didn't look flattering at all.
